<?xml version="1.0" encoding="utf-8"?>

<!-- Default Windows installation (originally created for Windows 7, but since stuff for 8 and 10 got added). -->
<ApplicationBehaviors
  xmlns="http://whatheco.de/abc/workspaces/windows/ApplicationBehaviors"
  xmlns:xsi="http://www.w3.org/2001/XMLSchema-instance"
  xsi:schemaLocation="http://whatheco.de/abc/workspaces/windows ApplicationBehaviors.xsd"
  Guid="{F13D1F88-05E6-4DDA-B606-9B9BE53E4334}">

  <!-- Common windows which need to be ignored in all applications. -->
  <CommonIgnoreWindows>
    <!-- Shadow of menus and tooltips. -->
    <Window ClassName="SysShadow" />
    <!-- Tooltips. -->
    <Window ClassName="tooltips_class32" />

    <!-- TODO: What are these exactly? -->
    <Window ClassName="GDI+ Hook Window Class" />
    <Window ClassName="IME" />
    <Window ClassName="MSCTFIME UI" />
    <Window ClassName="WorkerW" />
    <!-- TODO: How unique are these class names? Do we need wildcard support? -->
    <Window ClassName=".NET-BroadcastEventWindow.4.0.0.0.5c39d4.0" />
    <Window ClassName="WindowsForms10.Window.0.app.0.5c39d4_r20_ad1" />
  </CommonIgnoreWindows>

  <!-- Explorer. -->
  <Process Name="explorer" CompanyName="Microsoft Corporation">
    <IgnoreWindows>
      <!-- Start button. -->
      <Window ClassName="Button" />
      <!-- Start bar. -->
      <Window ClassName="Shell_TrayWnd" />
      <!-- Start menu. -->
      <Window ClassName="DV2ControlHost" />
      <!-- Start menu user picture. -->
      <Window ClassName="Desktop User Picture" />
      <!-- Desktop icons. -->
      <Window ClassName="Progman" />
      <!-- View available networks dialog and tooltip. -->
      <Window ClassName="NativeHWNDHost" />
      <Window ClassName="VANUITooltip" />

      <!-- TODO: Get more information on these windows, what they are, and whether they should really be ignored. -->
      <Window ClassName="_SearchEditBoxFakeWindow" />
      <Window ClassName="AUTHUI.DLL: Shutdown Choices Message Window" />
      <Window ClassName="Auto-Suggest Dropdown" />
      <Window ClassName="ComboLBox" />
      <Window ClassName="Media Center SSO" />
      <Window ClassName="PrintCacheLocalConnectionListenerHiddenWindow" />
      <Window ClassName="PrintCacheListenerWindow_19A79E3F-0006-4175-AACD-6F5C69CC0D23" />
      <Window ClassName="TaskSwitcherWnd" />
    </IgnoreWindows>
    <HideBehavior>
      <Default Hide="SelectedWindow" />
    </HideBehavior>
  </Process>

  <!-- This process triggered a window once a Windows Phone was plugged in, used to indicate the phone is connected, and to open up the related software. -->
  <!-- Noticed when plugging in a Nokia Lumia 720. -->
  <!-- TODO: Should some of its windows be handled differently? -->
  <Process Name="Dxpserver" CompanyName="Microsoft Corporation">
    <IgnoreWindows Mode="AllExcept" />
  </Process>

  <!-- Windows Ink Services Platform Tablet Input Subsystem. -->
  <!-- TODO: Verify what these windows do exactly, and whether they can be ignored. -->
  <Process Name="wisptis" CompanyName="Microsoft Corporation">
    <IgnoreWindows>
      <Window ClassName="wisptis_feedback_window" />
    </IgnoreWindows>
  </Process>

  <!-- Taskhost is used as the host for all DLL based services that are run. -->
  <Process Name="taskhost" CompanyName="Microsoft Corporation">
    <IgnoreWindows>
      <!-- TODO: Showing this window doesn't make it show up, but where is this coming from? -->
      <Window ClassName="COMTASKSWINDOWCLASS" />
    </IgnoreWindows>
  </Process>

  <!-- Window 10 weather metro app. -->
  <Process Name="Microsoft.Msn.Weather" CompanyName="Microsoft Corporation">
    <IgnoreWindows>
      <Window ClassName="Windows.UI.Core.CoreWindow" />
    </IgnoreWindows>
  </Process>

  <!-- Window 10 e-mail metro app. -->
  <Process Name="HxMail" CompanyName="Microsoft Corporation">
    <IgnoreWindows>
      <Window ClassName="Windows.UI.Core.CoreWindow" />
    </IgnoreWindows>
  </Process>

  <!-- Default built-in windows photo viewer. -->
  <Process Name="dllhost" CompanyName="Microsoft Corporation">
    <HideBehavior>
      <Default Hide="SelectedWindow" />
    </HideBehavior>
  </Process>
  
</ApplicationBehaviors>